id,SMS,,,,,,,,,,
79063,Don't necessarily expect it to be done before you get back though because I'm just now headin out,,,,,,,,,,
94852,Mmm so yummy babe ... Nice jolt to the suzy,,,,,,,,,,
21000,Where are you lover ? I need you ...,,,,,,,,,,
63935,We tried to contact you re your reply to our offer of a Video Handset? 750 anytime networks mins? UNLIMITED TEXT? Camcorder? Reply or call 08000930705 NOW,,,,,,,,,,
24269,I‘m parked next to a MINI!!!! When are you coming in today do you think?,,,,,,,,,,
81483,Yup,,,,,,,,,,
71834,Anyway i'm going shopping on my own now. Cos my sis not done yet. Dun disturb u liao.,,,,,,,,,,
74687,MY NO. IN LUTON 0125698789 RING ME IF UR AROUND! H*,,,,,,,,,,
86369,Hey I am really horny want to chat or see me naked text hot to 69698 text charged at 150pm to unsubscribe text stop 69698,,,,,,,,,,
14249,Why you Dint come with us.,,,,,,,,,,
50605,Same. Wana plan a trip sometme then,,,,,,,,,,
47190,Not sure yet, still trying to get a hold of him,,,,,,,,,
49449,Ur ringtone service has changed! 25 Free credits! Go to club4mobiles.com to choose content now! Stop? txt CLUB STOP to 87070. 150p/wk Club4 PO Box1146 MK45 2WT,,,,,,,,,,
20110,The evo. I just had to download flash. Jealous?,,,,,,,,,,
84411,Ringtone Club: Get the UK singles chart on your mobile each week and choose any top quality ringtone! This message is free of charge.,,,,,,,,,,
68532,Come to mu, we're sorting out our narcotics situation,,,,,,,,,
53296,Night has ended for another day, morning has come in a special way. May you smile like the sunny rays and leaves your worries at the blue blue bay.,,,,,,,,,
49923,HMV BONUS SPECIAL 500 pounds of genuine HMV vouchers to be won. Just answer 4 easy questions. Play Now! Send HMV to 86688 More info:www.100percent-real.com,,,,,,,,,,
28916,Usf I guess, might as well take 1 car,,,,,,,,,
98858,No objection. My bf not coming.,,,,,,,,,,
31986,Thanx...,,,,,,,,,,
27746,Tell rob to mack his gf in the theater,,,,,,,,,,
30396,Awesome, I'll see you in a bit,,,,,,,,,
22881,Just sent it. So what type of food do you like?,,,,,,,,,,
96194,All done? All handed in? Celebrations in full swing yet?,,,,,,,,,,
16998,You got called a tool?,,,,,,,,,,
11977,Sorry, my battery died, I can come by but I'm only getting a gram for now, where's your place?,,,,,,,
40841,Well done, blimey, exercise, yeah, i kinda remember wot that is, hmm. ,,,,,
75393,I wont get concentration dear you know you are my mind and everything :-),,,,,,,,,,
22831,LOL ... Have you made plans for new years?,,,,,,,,,,
31213,10 min later k...,,,,,,,,,,
26592,hanks lotsly!,,,,,,,,,,
68689,Thanks for this hope you had a good day today,,,,,,,,,,
76396,K:)k:)what are detail you want to transfer?acc no enough?,,,,,,,,,,
35146,Ok i will tell her to stay out. Yeah its been tough but we are optimistic things will improve this month.,,,,,,,,,,
54808,Loan for any purpose £500 - £75,000. Homeowners + Tenants welcome. Have you been previously refused? We can still help. Call Free 0800 1956669 or text back 'help',,,,,,,,,
21649,Si si. I think ill go make those oreo truffles.,,,,,,,,,,
74397,LOOK AT AMY URE A BEAUTIFUL, INTELLIGENT WOMAN AND I LIKE U A LOT. I KNOW U DONT LIKE ME LIKE THAT SO DONT WORRY.,,,,,,,,,
33624,I hope you that's the result of being consistently intelligent and kind. Start asking him about practicum links and keep your ears open and all the best. ttyl,,,,,,,,,,
83614,1.20 that call cost. Which i guess isnt bad. Miss ya, need ya, want ya, love ya,,,,,,,
14346,Going thru a very different feeling.wavering decisions and coping up with the same is the same individual.time will heal everything i believe.,,,,,,,,,,
41880,Where did u go? My phone is gonna die you have to stay in here,,,,,,,,,,
27960,Great. Never been better. Each day gives even more reasons to thank God,,,,,,,,,,
